{
  "schemaVersion": 1,
  "name": "Aelix official catalog",
  "updated": "2026-10-12T16:19:01.565499Z",
  "extensions": [
    {
      "name": "aelix-memory",
      "source": "git+https://github.com/handochan/aelix-memory.git@c36703d3acb28456a45436fff682ff0f181b2c58",
      "description": "Fixed startup summary and on-demand memory tools, with automatic learning; /memory controls global usage and project records.",
      "version": "0.4.0",
      "homepage": "https://github.com/handochan/aelix-memory",
      "tags": [
        "memory",
        "panel",
        "settings",
        "automatic-memory",
        "prompt-cache"
      ]
    },
    {
      "name": "aelix-webtool",
      "source": "git+https://github.com/handochan/aelix-webtool.git@5fcb5878cf67f97b459c1f40897d2534c2e1ca7d",
      "description": "Keyless DuckDuckGo or configured web search, batch queries and public-page snapshots with cached read/find.",
      "version": "0.2.0",
      "homepage": "https://github.com/handochan/aelix-webtool"
    }
  ]
}
